<?xml version="1.0" encoding="UTF-8"?>
<transformationModel xmlns="http://www.example.org/TransformationModel"
      xmlns:xsi="http://www.w3.org/2001/XMLSchema-instance"
      xsi:schemaLocation="http://www.example.org/TransformationModel TransformationModel.xsd">
    <transformationGraph>
	    <packNode id="1" name="Pack1" isSplitter="true" x="150" y="50">
	    	<output node="2" />
	    </packNode>
	    <packTransformerNode id="2" name="transformer1" x="150" y="125">
	    	<input node="1" />
	    	<output node="3" />
	    </packTransformerNode>
	    <packNode id="3" name="Pack2" x="150" y="200">
	    	<input node="2" />
	    </packNode>
    </transformationGraph>
</transformationModel>
